{
  "message_type": "result",
  "message_id": "msg-task-example-01-a1",
  "project_id": "project-example",
  "task_id": "task-example-01",
  "attempt_id": "attempt-task-example-01-a1",
  "scope_revision": 0,
  "alignment_digest": "sha256:0000000000000000000000000000000000000000000000000000000000000000",
  "sender": "api-worker-01",
  "summary": "The bounded example API change and focused tests are complete.",
  "status": "completed",
  "no_findings": false,
  "key_findings": [
    {
      "severity": "note",
      "finding": "The requested API behavior is implemented and verified.",
      "evidence_refs": [
        "artifact://evidence/task-example-01-tests"
      ],
      "recommended_action": "Proceed to Team Leader review and integration."
    }
  ],
  "deliverable_refs": [
    "artifact://changes/task-example-01-a1"
  ],
  "change_refs": [
    "git://commit/0123456789abcdef0123456789abcdef01234567"
  ],
  "evidence_refs": [
    "artifact://evidence/task-example-01-tests"
  ],
  "acceptance": [
    {
      "criterion": "Focused tests pass.",
      "status": "pass",
      "evidence_refs": [
        "artifact://evidence/task-example-01-tests"
      ]
    }
  ],
  "assumptions": [],
  "residual_risks": [],
  "requested_action": "review_and_integrate",
  "confidence": "high"
}
